id	title	meter	full	p1	p2	p3	p4	pr_p1	pr_p2	pr_p3	pr_p4	needs_split_practice	has_p12	has_p34	अर्थः	meaning
niti_001	नीतिशतकम् 1	अनुष्टुप्	दिक्-कालाद्यनवच्छिन्नानन्त-चिन्-मात्र-मूर्तये । स्वानुभूत्य्-एक-मानाय नमः शान्ताय तेजसे ॥	दिक्-कालाद्यनवच्छिन्नानन्त-चिन्-मात्र-मूर्तये ।		स्वानुभूत्य्-एक-मानाय नमः शान्ताय तेजसे ॥		दिक्-कालाद्यनवच्छिन्नानन्त-चिन्-मात्र-मूर्तये ।		स्वानुभूत्य्-एक-मानाय नमः शान्ताय तेजसे ॥		TRUE	TRUE	TRUE	संस्कृतार्थम् अत्र स्थापयामि	Salutations to that peaceful Light, which is the embodiment of pure, infinite consciousness, unconditioned by direction, time, etc., and which can be known only through self-realization.
niti_002	नीतिशतकम् 2	अनुष्टुप्	बोद्धारो मत्सर-ग्रस्ताः प्रभवः स्मय-दूषिताः । अबोधोपहताः चान्ये जीर्णमङ्गे सुभाषितम् ॥	बोद्धारो मत्सर-ग्रस्ताः	प्रभवः स्मय-दूषिताः ।	अबोधोपहताः चान्ये	जीर्णमङ्गे सुभाषितम् ॥					FALSE	TRUE	TRUE	विद्वांसः द्वेषेण आवृताः । समर्थाः राजानः अहङ्कारेण मलिनाः । इतरे साधारणाः सुभाषितानि अवगन्तुम् असमर्थाः । एवं सति सुभाषितं वक्तुः मुखे एव जीर्णं भवति ।व्यर्थः भवति इति भावः ।	The learned are consumed by envy, the powerful are corrupted by pride, and others are afflicted with ignorance. Thus, wise sayings perish within oneself, finding no worthy recipient.
niti_003	नीतिशतकम् 3	आर्या	अज्ञः सुखमाराध्यः सुखतरमाराध्यते विशेषज्ञः । ज्ञान-लव-दुर्विदग्धं ब्रह्मापि नरं न रञ्जयति ॥	अज्ञः सुखमाराध्यः	सुखतरमाराध्यते विशेषज्ञः ।	ज्ञान-लव-दुर्विदग्धम्	ब्रह्मापि नरं न रञ्जयति ॥					FALSE	TRUE	TRUE	संस्कृतार्थम्  अत्र स्थापयामि	An ignorant person is easy to please, and an expert is even easier to please. However, even the creator Brahma cannot satisfy a person who is puffed up with a mere particle of knowledge.
niti_004	नीतिशतकम् 4	पृथ्वी	प्रसह्य मणिमुद्धरेन्मकर-वक्त्र-दंष्ट्रान्तरात्समुद्रमपि सन्तरेत्प्रचलदूर्मि-मालाकुलम् । भुजङ्गमपि कोपितं शिरसि पुष्पवद्धारयेत्न तु प्रतिनिविष्ट-मूर्ख-जन-चित्तमाराधयेत् ॥	प्रसह्य मणिमुद्धरेन्मकर-वक्त्र-दंष्ट्रान्तरात्	समुद्रमपि सन्तरेत्प्रचलदूर्मि-मालाकुलम् ।	 भुजङ्गमपि कोपितं शिरसि पुष्पवद्धारयेत्	न तु प्रतिनिविष्ट-मूर्ख-जन-चित्तमाराधयेत् ॥					FALSE	TRUE	TRUE	संस्कृतार्थम्  अत्र स्थापयामि	One might forcibly extract a gem from between a crocodile's teeth, cross an ocean agitated by rows of surging waves, and even wear an enraged serpent on one's head like a flower. But one can never please the mind of a stubborn fool.
niti_005	नीतिशतकम् 5	पृथ्वी	लभेत सिकतासु तैलमपि यत्नतः पीडयन्पिबेच्च मृग-तृष्णिकासु सलिलं पिपासार्दितः । कदाचिदपि पर्यटन् शशविषाणमासादयेन्नतु प्रतिनिविष्ट-मूर्ख-जन-चित्तमाराधयेत् ॥	लभेत सिकतासु तैलमपि यत्नतः पीडयन्	पिबेच्च मृग-तृष्णिकासु सलिलं पिपासार्दितः ।	 कदाचिदपि पर्यटन् शशविषाणमासादयेत्	न तु प्रतिनिविष्ट-मूर्ख-जन-चित्तमाराधयेत् ॥					FALSE	TRUE	TRUE	संस्कृतार्थम्  अत्र स्थापयामि	By pressing with effort, one might even obtain oil from sand; tormented by thirst, one might drink water from a mirage; and while wandering, one might even find a hare's horn. But one can never please the mind of a stubborn fool.
niti_006	नीतिशतकम् 6	शार्दूलविक्रीडितम्	व्यालं बाल-मृणाल-तन्तुभिरसौ रोद्धुं समुज्जृम्भते छेत्तुं वज्र-मणिं शिरीष-कुसुम-प्रान्तेन सन्नह्यति । माधुर्यं मधु-बिन्दुना रचयितुं क्षारामुधेरीहते नेतुं वाञ्छन्ति यः खलान्पथि सतां सूक्तैः सुधा-स्यन्दिभिः ॥	व्यालं बाल-मृणाल-तन्तुभिरसौ रोद्धुं समुज्जृम्भते	छेत्तुं वज्र-मणिं शिरीष-कुसुम-प्रान्तेन सन्नह्यति ।		माधुर्यं मधु-बिन्दुना रचयितुं क्षारामुधेरीहते					FALSE	TRUE	TRUE	संस्कृतार्थम्  अत्र स्थापयामि	He who wishes to lead the wicked onto the path of the good with nectar-dripping wise sayings is attempting the impossible. It is like trying to restrain a rogue elephant with lotus filaments, cut a diamond with a Siris flower's powderpuff edge, or sweeten the salt ocean with a drop of honey.
niti_007	नीतिशतकम् 7	उपजातिः अनन्तरोदीरितलक्ष्मभाजौ पादौ यदीयावुपजातयस्ताः	स्वायत्तमेकान्त-गुणं विधात्रा विनिर्मितं छादनमज्ञतायाः । विशेषतः सर्व-विदां समाजे विभूषणं मौनमपण्डितानाम् ॥	स्वायत्तमेकान्त-गुणं विधात्रा 	विनिर्मितं छादनमज्ञतायाः ।	विशेषतः सर्व-विदां समाजे ।	विभूषणं मौनमपण्डितानाम् ॥					FALSE	TRUE	TRUE	संस्कृतार्थम्  अत्र स्थापयामि	The Creator has fashioned silence as a covering for ignorance, a virtue entirely within one's own control. Especially in an assembly of the learned, silence is an ornament for the unscholarly